{
  "$schema": "https://github.com/AlisinaDevelo/CARTOGRAPH/schema/ownership-waiver-drift-fixtures.v0.1.schema.json",
  "schemaVersion": 1,
  "contract": "cartograph.ownership-waiver-drift",
  "mediaType": "application/vnd.cartograph.ownership-waiver-drift+json",
  "fixtureId": "g004-v0.1",
  "method": {
    "replayMode": "checked-in-ownership-waiver-states",
    "rerunnable": true,
    "network": false,
    "sourceBodiesIncluded": false,
    "credentialsUsed": false,
    "hiddenTelemetry": false,
    "appendOnly": true,
    "authorityFree": true,
    "command": "npm run ownership-waiver-drift:validate"
  },
  "scenarios": [
    {
      "id": "repository-policy-key-and-workspace-drift",
      "input": {
        "schemaVersion": 1,
        "contract": "cartograph.ownership-waiver-drift",
        "previous": {
          "schemaVersion": 1,
          "contract": "cartograph.ownership-waiver-drift",
          "revision": "revision-previous",
          "at": "2030-02-01T00:00:00.000Z",
          "workspace": {
            "id": "workspace-main",
            "repositoryIds": ["repo-a", "repo-b", "repo-c"],
            "complete": true,
            "missingRepositoryIds": []
          },
          "policyId": "architecture-policy",
          "policyVersion": "1.0.0",
          "evidenceRevision": "evidence-v1",
          "ownership": {
            "schemaVersion": 1,
            "contract": "cartograph.ownership-resolution",
            "mediaType": "application/vnd.cartograph.ownership-resolution+json",
            "provenance": {
              "resolver": "cartograph.ownership-resolution",
              "resolverVersion": "1",
              "inputDigest": "sha256:2222222222222222222222222222222222222222222222222222222222222222",
              "sourceBodiesIncluded": false
            },
            "summary": {
              "targets": 3,
              "resolved": 3,
              "unowned": 0,
              "ambiguous": 0,
              "unavailable": 0,
              "unsupported": 0,
              "matchedRules": 3
            },
            "results": [
              {
                "target": {
                  "id": "checkout-v1",
                  "repositoryId": "repo-a",
                  "path": "packages/checkout/src/index.ts",
                  "stableKey": "module:checkout",
                  "kind": "node"
                },
                "status": "resolved",
                "owners": ["team:payments"],
                "matches": [],
                "evidence": [
                  {
                    "sourceId": "ownership-a",
                    "sourcePath": ".cartograph/ownership.json",
                    "matchedPath": "current",
                    "reference": "ownership://rule/checkout-v1"
                  }
                ],
                "diagnosticCodes": []
              },
              {
                "target": {
                  "id": "legacy-v1",
                  "repositoryId": "repo-a",
                  "path": "packages/legacy/src/index.ts",
                  "stableKey": "module:legacy",
                  "kind": "node"
                },
                "status": "resolved",
                "owners": ["team:legacy"],
                "matches": [],
                "evidence": [
                  {
                    "sourceId": "ownership-a",
                    "sourcePath": ".cartograph/ownership.json",
                    "matchedPath": "current",
                    "reference": "ownership://rule/legacy-v1"
                  }
                ],
                "diagnosticCodes": []
              },
              {
                "target": {
                  "id": "docs-v1",
                  "repositoryId": "repo-a",
                  "path": "docs/guide.md",
                  "stableKey": "file:docs-guide",
                  "kind": "file"
                },
                "status": "resolved",
                "owners": ["team:docs"],
                "matches": [],
                "evidence": [
                  {
                    "sourceId": "ownership-a",
                    "sourcePath": ".cartograph/ownership.json",
                    "matchedPath": "current",
                    "reference": "ownership://rule/docs-v1"
                  }
                ],
                "diagnosticCodes": []
              }
            ],
            "diagnostics": []
          },
          "waiverEvaluation": {
            "schemaVersion": 1,
            "contract": "cartograph.architecture-waiver",
            "mediaType": "application/vnd.cartograph.architecture-waiver+json",
            "policyId": "architecture-policy",
            "policyVersion": "1.0.0",
            "policyStatus": "violations",
            "inputKind": "snapshot",
            "inputDigest": "sha256:2222222222222222222222222222222222222222222222222222222222222222",
            "status": "violations",
            "authorityGranted": false,
            "violations": [
              {
                "id": "violation:boundary",
                "policyId": "architecture-policy",
                "ruleId": "boundary",
                "target": "node",
                "assertion": "exists",
                "effect": "enforce",
                "count": 0,
                "matches": [],
                "reason": "boundary is absent",
                "evidenceRefs": ["node:boundary"]
              }
            ],
            "unsupported": [],
            "suppressed": [],
            "waivers": [
              {
                "id": "waiver-expiring",
                "ruleId": "boundary",
                "status": "active",
                "code": "WAIVER_ACTIVE",
                "precedence": 1,
                "suppresses": false,
                "authorityGranted": false,
                "reason": "signed waiver is active",
                "evidenceRefs": ["waiver:waiver-expiring"]
              },
              {
                "id": "waiver-expired",
                "ruleId": "boundary",
                "status": "active",
                "code": "WAIVER_ACTIVE",
                "precedence": 1,
                "suppresses": false,
                "authorityGranted": false,
                "reason": "signed waiver is active",
                "evidenceRefs": ["waiver:waiver-expired"]
              },
              {
                "id": "waiver-invalid-signature",
                "ruleId": "boundary",
                "status": "active",
                "code": "WAIVER_ACTIVE",
                "precedence": 1,
                "suppresses": false,
                "authorityGranted": false,
                "reason": "signed waiver is active",
                "evidenceRefs": ["waiver:waiver-invalid-signature"]
              },
              {
                "id": "waiver-evidence",
                "ruleId": "boundary",
                "status": "active",
                "code": "WAIVER_ACTIVE",
                "precedence": 1,
                "suppresses": false,
                "authorityGranted": false,
                "reason": "signed waiver is active",
                "evidenceRefs": ["waiver:waiver-evidence"]
              },
              {
                "id": "waiver-policy",
                "ruleId": "boundary",
                "status": "active",
                "code": "WAIVER_ACTIVE",
                "precedence": 1,
                "suppresses": false,
                "authorityGranted": false,
                "reason": "signed waiver is active",
                "evidenceRefs": ["waiver:waiver-policy"]
              }
            ],
            "summary": {
              "waivers": 5,
              "active": 5,
              "expiring": 0,
              "suppressed": 0,
              "invalid": 0,
              "unsigned": 0,
              "replayed": 0,
              "expired": 0
            },
            "provenance": {
              "resolver": "cartograph.architecture-waiver",
              "resolverVersion": "1",
              "inputDigest": "sha256:2222222222222222222222222222222222222222222222222222222222222222",
              "network": false,
              "sourceBodiesIncluded": false,
              "privateKeysIncluded": false,
              "authorityGranted": false,
              "deterministic": true
            }
          },
          "waivers": [
            {
              "id": "waiver-expiring",
              "ruleId": "boundary",
              "policyVersion": "1.0.0",
              "evidenceRevision": "evidence-v1",
              "createdAt": "2030-01-01T00:00:00.000Z",
              "expiresAt": "2030-03-01T00:00:00.000Z",
              "waiverDigest": "sha256:aaaaaaaaaaaaaaaaaaaaaaaaaaaaaaaaaaaaaaaaaaaaaaaaaaaaaaaaaaaaaaaa",
              "scopeDigest": "sha256:aaaaaaaaaaaaaaaaaaaaaaaaaaaaaaaaaaaaaaaaaaaaaaaaaaaaaaaaaaaaaaaa",
              "affectedIds": ["node:boundary"],
              "signerKeyId": "key-old",
              "trustRootIds": ["root-local"],
              "status": "active",
              "code": "WAIVER_ACTIVE",
              "evidenceRefs": ["waiver:waiver-expiring"]
            },
            {
              "id": "waiver-expired",
              "ruleId": "boundary",
              "policyVersion": "1.0.0",
              "evidenceRevision": "evidence-v1",
              "createdAt": "2030-01-01T00:00:00.000Z",
              "expiresAt": "2030-03-01T00:00:00.000Z",
              "waiverDigest": "sha256:bbbbbbbbbbbbbbbbbbbbbbbbbbbbbbbbbbbbbbbbbbbbbbbbbbbbbbbbbbbbbbbb",
              "scopeDigest": "sha256:bbbbbbbbbbbbbbbbbbbbbbbbbbbbbbbbbbbbbbbbbbbbbbbbbbbbbbbbbbbbbbbb",
              "affectedIds": ["node:boundary"],
              "signerKeyId": "key-old",
              "trustRootIds": ["root-local"],
              "status": "active",
              "code": "WAIVER_ACTIVE",
              "evidenceRefs": ["waiver:waiver-expired"]
            },
            {
              "id": "waiver-invalid-signature",